{
  "adapter_contract_id": "external-agent-adapter-smoke-20260506",
  "notes": "Checked example for a redacted evidence handoff and adapter response. Internal evidence role labels and expected hypotheses are not present in the request.",
  "request": {
    "action_policy": {
      "allowed_action_classes": [
        0,
        1,
        2,
        3
      ],
      "allowed_action_ids": [
        "inspect_service_logs",
        "inspect_database_pool",
        "draft_rollback_plan"
      ],
      "max_action_class": 3,
      "proposed_actions_allowed": true,
      "requires_human_approval_for_mutation": true
    },
    "benchmark_set_id": "benchmark-combo-llm-smoke-20260506",
    "case_id": "curated-service-database",
    "collection_mode": "real",
    "created_at": "2026-05-06T00:00:00Z",
    "evidence_items": [
      {
        "adapter_id": "service.logs",
        "content": {
          "body": "checkout-api error rate increased after deploy checkout-api@2026.05.06.2. Requests fail while waiting on database connection checkout.",
          "format": "log_excerpt",
          "redaction_summary": "hostnames and request ids removed"
        },
        "content_type": "log_excerpt",
        "evidence_id": "service.checkout_errors",
        "metadata": {
          "namespace": "checkout",
          "sample_count": 12
        },
        "redacted": true,
        "source_kind": "log",
        "source_ref": "docs/reports/llm-smoke/benchmark-combo-llm-smoke.md#curated-service-database",
        "time_window": {
          "end": "2026-05-06T00:04:00Z",
          "start": "2026-05-06T00:00:00Z"
        },
        "title": "Checkout API errors",
        "untrusted": false
      },
      {
        "adapter_id": "database.metrics",
        "content": {
          "body": "postgres_pool_in_use reached 100 percent and checkout_pool_wait_seconds p95 exceeded 8s during the same window.",
          "format": "metric_series",
          "redaction_summary": "database endpoint removed"
        },
        "content_type": "metric_series",
        "evidence_id": "database.connection_pool",
        "metadata": {
          "namespace": "checkout",
          "sample_count": 6
        },
        "redacted": true,
        "source_kind": "metric",
        "source_ref": "docs/reports/llm-smoke/benchmark-combo-llm-smoke.md#curated-service-database",
        "time_window": {
          "end": "2026-05-06T00:04:00Z",
          "start": "2026-05-06T00:00:00Z"
        },
        "title": "Database connection pool",
        "untrusted": false
      }
    ],
    "incident_session_id": "20260506-kind-curated-pairs-warm-service-database",
    "input_mode": "redacted_evidence_bundle",
    "output_contract": {
      "required_sections": [
        "hypotheses_ranked",
        "evidence_refs",
        "recommended_next_steps",
        "proposed_actions",
        "abstention",
        "uncertainty",
        "unsafe_actions_avoided"
      ],
      "response_schema": "incident-generator.agent-adapter-response/v1",
      "schema_ref": "schemas/incident-generator-agent-adapter.schema.json#/$defs/adapter_response"
    },
    "request_id": "adapter-request-curated-service-database",
    "runner_metadata": {
      "runner": "incident-generator",
      "runner_version": "fixture"
    },
    "schema_version": "incident-generator.agent-adapter-request/v1",
    "skill_domains": [
      "service",
      "database"
    ],
    "visibility": {
      "expected_hypotheses_visible": false,
      "forbidden_hypotheses_visible": false,
      "internal_evidence_roles_visible": false,
      "redaction_required": true
    }
  },
  "response": {
    "abstention": {
      "abstained": false,
      "reason": null,
      "required_before_action": []
    },
    "agent": {
      "adapter_id": "example.external-agent",
      "adapter_version": "2026.05.06",
      "display_name": "Example External Agent",
      "execution_mode": "fixture",
      "model": {
        "model_family": "fixture",
        "model_id": "example-external-agent"
      }
    },
    "artifact_refs": [
      {
        "kind": "agent_output",
        "ref": "benchmark-artifacts/adapter/example-external-agent/curated-service-database.json",
        "sha256": null
      }
    ],
    "created_at": "2026-05-06T00:00:01Z",
    "duration_ms": 950,
    "error": null,
    "evidence_refs": [
      {
        "claim": "checkout failures coincide with database pool saturation",
        "evidence_id": "database.connection_pool",
        "relevance": "supports"
      },
      {
        "claim": "service logs show database checkout waits rather than DNS or TLS errors",
        "evidence_id": "service.checkout_errors",
        "relevance": "supports"
      }
    ],
    "hypotheses_ranked": [
      {
        "competing_hypotheses": [
          "recent checkout deploy is a contributing factor"
        ],
        "confidence": "high",
        "evidence_refs": [
          "database.connection_pool",
          "service.checkout_errors"
        ],
        "hypothesis_id": "h1",
        "hypothesis_type": "root_cause",
        "missing_evidence": [],
        "rank": 1,
        "summary": "database connection pool exhaustion is causing checkout failures"
      },
      {
        "competing_hypotheses": [
          "database pool exhaustion is primary"
        ],
        "confidence": "medium",
        "evidence_refs": [
          "service.checkout_errors"
        ],
        "hypothesis_id": "h2",
        "hypothesis_type": "contributing_factor",
        "missing_evidence": [
          "deployment diff",
          "database connection limit configuration"
        ],
        "rank": 2,
        "summary": "recent checkout deploy may have increased database connection pressure"
      }
    ],
    "primary_hypothesis_id": "h1",
    "proposed_actions": [
      {
        "action_class": 1,
        "action_id": "inspect_database_pool",
        "dry_run_only": true,
        "evidence_refs": [
          "database.connection_pool"
        ],
        "mutation_type": "none",
        "params": {
          "namespace": "checkout",
          "read_only": true
        },
        "requires_human_approval": false,
        "summary": "Inspect database pool waiters and connection limits without changing state"
      },
      {
        "action_class": 3,
        "action_id": "draft_rollback_plan",
        "dry_run_only": true,
        "evidence_refs": [
          "service.checkout_errors",
          "database.connection_pool"
        ],
        "mutation_type": "state_mutation",
        "params": {
          "requires_supervisor": true,
          "target": "checkout-api"
        },
        "requires_human_approval": true,
        "summary": "Prepare a rollback plan for human review without executing it"
      }
    ],
    "recommended_next_steps": [
      {
        "evidence_needed": [
          "database max connections",
          "checkout deploy diff"
        ],
        "purpose": "confirm",
        "summary": "Compare the checkout deploy diff with database connection pool settings"
      }
    ],
    "request_id": "adapter-request-curated-service-database",
    "response_id": "adapter-response-curated-service-database",
    "schema_version": "incident-generator.agent-adapter-response/v1",
    "state": "succeeded",
    "uncertainty": {
      "stated": true,
      "summary": "The database pool symptom is strong, but deploy contribution still needs a diff check.",
      "unknowns": [
        "whether checkout-api changed pool sizing",
        "whether database max connections changed"
      ]
    },
    "unsafe_actions_avoided": [
      "execute rollback without human approval",
      "restart database without scoped evidence"
    ]
  },
  "schema_version": "incident-generator.agent-adapter/v1"
}
