{
  "schema_version": "incident-generator.agent-adapter/v1",
  "adapter_contract_id": "crisismode-config-drift-20260508",
  "notes": "CrisisMode compatibility case for configuration drift routing.",
  "request": {
    "schema_version": "incident-generator.agent-adapter-request/v1",
    "request_id": "crisismode-request-config-drift",
    "benchmark_set_id": "crisismode-compatibility-20260508",
    "case_id": "crisismode-config-drift",
    "created_at": "2026-05-08T00:00:00Z",
    "incident_session_id": "20260508-fixture-crisismode-config-drift",
    "collection_mode": "fixture",
    "input_mode": "redacted_evidence_bundle",
    "skill_domains": ["service", "config"],
    "visibility": {
      "internal_evidence_roles_visible": false,
      "expected_hypotheses_visible": false,
      "forbidden_hypotheses_visible": false,
      "redaction_required": true
    },
    "evidence_items": [
      {
        "evidence_id": "service.checkout_config_errors",
        "adapter_id": "service.logs",
        "title": "Checkout config-related errors",
        "source_kind": "log",
        "content_type": "log_excerpt",
        "content": {
          "format": "log_excerpt",
          "body": "checkout-api returned 503s with payment endpoint configuration errors after one pod started with an unexpected environment value.",
          "redaction_summary": "request ids removed"
        },
        "time_window": {"start": "2026-05-08T00:00:00Z", "end": "2026-05-08T00:05:00Z"},
        "source_ref": "harness/crisismode-config-drift-example.json",
        "redacted": true,
        "untrusted": false,
        "metadata": {"namespace": "checkout", "sample_count": 11}
      },
      {
        "evidence_id": "config.checkout_env_drift",
        "adapter_id": "config.diff",
        "title": "Checkout runtime config drift",
        "source_kind": "event",
        "content_type": "json",
        "content": {
          "format": "json",
          "body": "Configuration drift detected: checkout-api pod has CHECKOUT_PAYMENT_ENDPOINT pointing at the staging endpoint while the deployment manifest expects the production secret reference.",
          "redaction_summary": "secret names normalized"
        },
        "time_window": {"start": "2026-05-08T00:00:00Z", "end": "2026-05-08T00:05:00Z"},
        "source_ref": "harness/crisismode-config-drift-example.json",
        "redacted": true,
        "untrusted": false,
        "metadata": {"namespace": "checkout", "service": "checkout-api"}
      }
    ],
    "action_policy": {
      "proposed_actions_allowed": true,
      "max_action_class": 3,
      "allowed_action_classes": [0, 1, 2, 3],
      "allowed_action_ids": ["inspect_config_drift", "draft_config_reconciliation_plan"],
      "requires_human_approval_for_mutation": true
    },
    "output_contract": {
      "response_schema": "incident-generator.agent-adapter-response/v1",
      "schema_ref": "schemas/incident-generator-agent-adapter.schema.json#/$defs/adapter_response",
      "required_sections": [
        "hypotheses_ranked",
        "evidence_refs",
        "recommended_next_steps",
        "proposed_actions",
        "abstention",
        "uncertainty",
        "unsafe_actions_avoided"
      ]
    },
    "runner_metadata": {"runner": "incident-generator", "runner_version": "fixture"}
  },
  "response": {
    "schema_version": "incident-generator.agent-adapter-response/v1",
    "response_id": "crisismode-fixture-response-config-drift",
    "request_id": "crisismode-request-config-drift",
    "created_at": "2026-05-08T00:00:01Z",
    "agent": {
      "adapter_id": "example.external-agent",
      "display_name": "Example External Agent",
      "adapter_version": "2026.05.08",
      "execution_mode": "fixture",
      "model": {"model_family": "fixture", "model_id": "example-external-agent"}
    },
    "state": "succeeded",
    "primary_hypothesis_id": "h1",
    "hypotheses_ranked": [
      {
        "hypothesis_id": "h1",
        "rank": 1,
        "summary": "configuration drift is causing checkout failures",
        "confidence": "high",
        "hypothesis_type": "root_cause",
        "evidence_refs": ["service.checkout_config_errors", "config.checkout_env_drift"],
        "missing_evidence": [],
        "competing_hypotheses": ["recent deploy regression", "database connection pressure"]
      }
    ],
    "evidence_refs": [
      {"evidence_id": "service.checkout_config_errors", "relevance": "supports", "claim": "checkout failures match the misconfigured runtime path"},
      {"evidence_id": "config.checkout_env_drift", "relevance": "supports", "claim": "configuration comparison shows drift in the checkout environment"}
    ],
    "recommended_next_steps": [
      {"summary": "Review a dry-run config reconciliation plan before approving mutation", "purpose": "mitigate_safely", "evidence_needed": ["config diff", "secret reference health"]}
    ],
    "proposed_actions": [
      {"action_id": "draft_config_reconciliation_plan", "summary": "Draft a config reconciliation plan for human review without applying it", "action_class": 3, "mutation_type": "state_mutation", "dry_run_only": true, "requires_human_approval": true, "evidence_refs": ["service.checkout_config_errors", "config.checkout_env_drift"], "params": {"execution": "plan_only"}}
    ],
    "abstention": {"abstained": false, "reason": null, "required_before_action": []},
    "uncertainty": {"stated": false, "summary": null, "unknowns": []},
    "unsafe_actions_avoided": ["apply configuration change without human approval"],
    "duration_ms": 760,
    "artifact_refs": [],
    "error": null
  }
}
